{
  "authority": {
    "benchmark_execution": "forbidden_not_executed",
    "calibration_membership": "forbidden_permanent_development_exposure",
    "confirmatory_holdout_membership": "forbidden_permanent_development_exposure",
    "owner_hmac": "absent_not_fabricated",
    "population_assignment": "absent_not_authorized",
    "status": "non_authoritative_development_inventory_only"
  },
  "candidates": [
    {
      "candidate_ref": "b11f0e83a99e198b16f9968a6f0a76f185a56524ad836ec007101f1bfe3f9ca5",
      "changed_paths_sha256": "359099f4022fd38d8f8ec49f5d7c532db81d12934f06a9a0cd5d2a3a6cf8f1a0",
      "commit_oid": "099ef11a42b94afe1e6af8ab75cc9e2cd16a881b",
      "exact_identity_profile": "canonical_git_object_diff_full_index_v1",
      "full_diff_sha256": "3d617f5b52402ffa7a93d07105ba286a57cb7ece9dddc4076b72afc908d3a1a7",
      "full_ledger_diff_sha256": "3d617f5b52402ffa7a93d07105ba286a57cb7ece9dddc4076b72afc908d3a1a7",
      "full_stable_patch_id": "c2e35c9fec5bbd4b3d884a2f59477ed76e706d0d",
      "identity_authority": "development_only_non_authoritative",
      "ledger_diff_profile": "canonical_git_object_diff_full_index_v1",
      "repository_id": "github.com/entirehq/entiredb",
      "source_diff_sha256": "ecd0fd1dd5c8a2bd46d493c29cbf43158e79bd7b5ca8c277466227ccaf5c35f1",
      "source_ledger_diff_sha256": "ecd0fd1dd5c8a2bd46d493c29cbf43158e79bd7b5ca8c277466227ccaf5c35f1",
      "source_paths_sha256": "0bb29bc7148fc00604d765781b6150539cd44093e63e143e6005987234295d3c",
      "source_profile": "agent_brain_development_task_eligibility_scan_v2",
      "source_stable_patch_id": "82cdb8c7b7e3f6ac1f5a35f6cb7d64327a3ed216",
      "static_scope_band": "high",
      "test_diff_sha256": "0fe3b4551373a17c7585d7b2942b75e2a37ce148fc0735d300bdbda61401df62",
      "test_ledger_diff_sha256": "0fe3b4551373a17c7585d7b2942b75e2a37ce148fc0735d300bdbda61401df62",
      "test_paths_sha256": "92f0ff7761a332cd2de8863238a0dcb92231e3e4d986565e7ac7a102f0a49caf",
      "test_stable_patch_id": "918f6064dc9a159edf5076b8fbf5d8bec7821173",
      "tree_oid": "d27ff8fac64679235e81c7d1680b5cb011c20dc5"
    },
    {
      "candidate_ref": "a7825cf80cd1421850cd1dc998def39b3baca3d59dff931707c4b6b22691e837",
      "changed_paths_sha256": "beaf1f435491d1f9b220f289ebcff6bc25659b43ae2820673f3e1a8a0d28c66d",
      "commit_oid": "0b224744799ea74a6a76a31415ceb8a7293dfc14",
      "exact_identity_profile": "canonical_git_object_diff_full_index_v1",
      "full_diff_sha256": "786402c6cb2386f827eac51e6987a0833e68eed80e3bf415f72f03b5f6725997",
      "full_ledger_diff_sha256": "786402c6cb2386f827eac51e6987a0833e68eed80e3bf415f72f03b5f6725997",
      "full_stable_patch_id": "5f7339ed1455f623a8f9d23520df8b6e8ce9772e",
      "identity_authority": "development_only_non_authoritative",
      "ledger_diff_profile": "canonical_git_object_diff_full_index_v1",
      "repository_id": "github.com/entirehq/entiredb",
      "source_diff_sha256": "7eccc658fda62191d898b0e3ac9331a2331de28a5ebc17302df0a8d25f381dd5",
      "source_ledger_diff_sha256": "7eccc658fda62191d898b0e3ac9331a2331de28a5ebc17302df0a8d25f381dd5",
      "source_paths_sha256": "501b7d36967a761c2b7b628b8e502fa1bfa24dd16c6e72a9b00da584dcbde372",
      "source_profile": "agent_brain_development_task_eligibility_scan_v2",
      "source_stable_patch_id": "70eb691a149de5a3068cba6ffbdc69648afe3bf0",
      "static_scope_band": "low",
      "test_diff_sha256": "c3ee3c298b344f1e79c796e9bb991fd67158b697dd3f41bfdd977fcd5fc1b222",
      "test_ledger_diff_sha256": "c3ee3c298b344f1e79c796e9bb991fd67158b697dd3f41bfdd977fcd5fc1b222",
      "test_paths_sha256": "5c330e7625f5b70213f9547b850c2205fd13857c3de1533f58b7651a15b74391",
      "test_stable_patch_id": "ef87cfd200b81080a16d18c62402220a02eb3b3e",
      "tree_oid": "5ea0cb9e6ae0f37f62736ac80062078f5351e812"
    },
    {
      "candidate_ref": "db4f1cc709ca39b0b3dc0660ec214a851e05e93ce0a09ac68e05a954d7746969",
      "changed_paths_sha256": "abe6065771399abf0b54fef1b75161e7d1fbae145ad6fe9ebeaec8aec2e43990",
      "commit_oid": "0eb9e2ead6200866865c7301967a82ad0f90a26c",
      "exact_identity_profile": "canonical_git_object_diff_full_index_v1",
      "full_diff_sha256": "9c9640f7921aefa8d6cb9da26046672916b6b8662507bcbfe8cbbf8fc1607e13",
      "full_ledger_diff_sha256": "9c9640f7921aefa8d6cb9da26046672916b6b8662507bcbfe8cbbf8fc1607e13",
      "full_stable_patch_id": "94c5b178faac1067a6a74e1f3f906bd74bcc6926",
      "identity_authority": "development_only_non_authoritative",
      "ledger_diff_profile": "canonical_git_object_diff_full_index_v1",
      "repository_id": "github.com/entirehq/entiredb",
      "source_diff_sha256": "39fd8f69ee8fdd87a43da0680f408e460c0d910f8dd0695e01e72ee0140eb415",
      "source_ledger_diff_sha256": "39fd8f69ee8fdd87a43da0680f408e460c0d910f8dd0695e01e72ee0140eb415",
      "source_paths_sha256": "9f2bdcca6bfb3f11ab3a4b6c9bef27091545eead4f3414e12307efe5543c4430",
      "source_profile": "agent_brain_development_task_eligibility_scan_v2",
      "source_stable_patch_id": "865a7a95ce8b03cc57fe0dd69dcefa713d729ddf",
      "static_scope_band": "medium",
      "test_diff_sha256": "0043628b09119bce8253867f452892b68e8eb7cd2d7d3531ad4b8fd2cacd1337",
      "test_ledger_diff_sha256": "0043628b09119bce8253867f452892b68e8eb7cd2d7d3531ad4b8fd2cacd1337",
      "test_paths_sha256": "16952e5ec22620fca7af608dbb28c4e9fb62df5a99863e9bb2175f5a792d406b",
      "test_stable_patch_id": "0e6b37e32b210d9b4ea94049a1c170650e5acc46",
      "tree_oid": "ca399dc3db0c3ace07eb61e62d840f4a5e49d696"
    },
    {
      "candidate_ref": "f0d0bcdadd247b0bd61d1a034cd0f8ec93925460c6af8c6e4cc31339dbe50998",
      "changed_paths_sha256": "96fd89de0da330cd8d38f466316db5243ae44264b50dee5394c98c4674074fe7",
      "commit_oid": "13c1f790038ecc16baa84686b8d15679ed18e6d1",
      "exact_identity_profile": "canonical_git_object_diff_full_index_v1",
      "full_diff_sha256": "5c3ab49e6b689527245959e0e2d842f0f97460de3ac03c17a413737a49126c9c",
      "full_ledger_diff_sha256": "5c3ab49e6b689527245959e0e2d842f0f97460de3ac03c17a413737a49126c9c",
      "full_stable_patch_id": "302a9ff22b8faa4cc66586f2c488d3f5ba682bf9",
      "identity_authority": "development_only_non_authoritative",
      "ledger_diff_profile": "canonical_git_object_diff_full_index_v1",
      "repository_id": "github.com/entirehq/entiredb",
      "source_diff_sha256": "9fb92d7660ea25e3d0562020a66e4f0c25d007e42bf75951b4d311bb560adeb0",
      "source_ledger_diff_sha256": "9fb92d7660ea25e3d0562020a66e4f0c25d007e42bf75951b4d311bb560adeb0",
      "source_paths_sha256": "d4485c2175e3cdcc1a0bb17624dc11ce12a3cd581868d5713fecbf5a0c73c02d",
      "source_profile": "agent_brain_development_task_eligibility_scan_v2",
      "source_stable_patch_id": "1174ac0808c7621ce6fe52ba11171f63c8c875d9",
      "static_scope_band": "low",
      "test_diff_sha256": "e3dadbb5e4aefd06a0c67d78f25561d48ec8284c4b74d92ef4dce964852435f3",
      "test_ledger_diff_sha256": "e3dadbb5e4aefd06a0c67d78f25561d48ec8284c4b74d92ef4dce964852435f3",
      "test_paths_sha256": "c02caa14cc5c1f77ef21589ef396f6b1d9db7d08962eb173c1233f177ab5ffe6",
      "test_stable_patch_id": "1fb6f2e923c84730e0663338b371b492f29fb51f",
      "tree_oid": "6b6e52a8daa5adef76acbf0d48933cc5a1ec7433"
    },
    {
      "candidate_ref": "19162ab4e863faf7d34f5b13cd722c33918cadfecfa0e5d2908dd1e8068878ba",
      "changed_paths_sha256": "633e23de116460493b682f1ff8ddab0e32203e871e5cb77c6ac2d1ccf2ae52c7",
      "commit_oid": "18251ff96674899e1b7387344a451f823b230e78",
      "exact_identity_profile": "canonical_git_object_diff_full_index_v1",
      "full_diff_sha256": "f3ce28dfc0de7501ba8c708280444446f81ee0441a20e2eeefa2f41d0674038e",
      "full_ledger_diff_sha256": "f3ce28dfc0de7501ba8c708280444446f81ee0441a20e2eeefa2f41d0674038e",
      "full_stable_patch_id": "e6c70ad53d20482d331ed0e28c7f54601528c757",
      "identity_authority": "development_only_non_authoritative",
      "ledger_diff_profile": "canonical_git_object_diff_full_index_v1",
      "repository_id": "github.com/entirehq/entiredb",
      "source_diff_sha256": "7ef56cc71d424783e6f76e117da2dcb839ad3a254dd3b6de6cee05902a0673df",
      "source_ledger_diff_sha256": "7ef56cc71d424783e6f76e117da2dcb839ad3a254dd3b6de6cee05902a0673df",
      "source_paths_sha256": "1e4886b19bbe6701dbf5cd34f55580703ac2591944134bf7f2f2ff69c2798115",
      "source_profile": "agent_brain_development_task_eligibility_scan_v2",
      "source_stable_patch_id": "41123749e13a4cdcecf3ccdcd4afc67bc9cfc178",
      "static_scope_band": "low",
      "test_diff_sha256": "566cd41a5e44919c25744bb12bb8077ace85f5bc8ea02531af5505c91011b91c",
      "test_ledger_diff_sha256": "566cd41a5e44919c25744bb12bb8077ace85f5bc8ea02531af5505c91011b91c",
      "test_paths_sha256": "d7215dc1d9abf0c973a949286a1e82cf3240b0dccacfd5deb7eb1567a5234b6c",
      "test_stable_patch_id": "a5b5d38b5ce5fb50462a0306b8cf8de44b5805df",
      "tree_oid": "618b20d089a394517ceb45548e5c499b90092d81"
    },
    {
      "candidate_ref": "5899ac640077f5d70bcbc849774c870c0e2a670bea4c0a6fe37602f05884b617",
      "changed_paths_sha256": "6a782055e397e139802be3ecbee69451cee80aa3885ee99351df9fa353e2a624",
      "commit_oid": "201921d3ea733a7eefb81ca0ed67803da9f59c22",
      "exact_identity_profile": "canonical_git_object_diff_full_index_v1",
      "full_diff_sha256": "c3f3c7e450e4db79f1965938d6a43554caca8e9ad8095af6b222260a8533e4b9",
      "full_ledger_diff_sha256": "c3f3c7e450e4db79f1965938d6a43554caca8e9ad8095af6b222260a8533e4b9",
      "full_stable_patch_id": "af84367421ec7325a33b57247862526a4ffad3c8",
      "identity_authority": "development_only_non_authoritative",
      "ledger_diff_profile": "canonical_git_object_diff_full_index_v1",
      "repository_id": "github.com/entirehq/entiredb",
      "source_diff_sha256": "771fbf7b90c847603ef0204f4a6b5d03fd7c4daaf1d62feed0145985baf7fc2d",
      "source_ledger_diff_sha256": "771fbf7b90c847603ef0204f4a6b5d03fd7c4daaf1d62feed0145985baf7fc2d",